{"$schema":"https://json-schema.org/draft/2020-12/schema","$id":"https://thedailyline.bet/schemas/video/v1/video-publication-package.schema.json","title":"VideoPublicationPackage","type":"object","additionalProperties":false,"required":["schema_version","publication_package_id","video_story_id","creative_variant_id","render_artifact_ref","render_manifest_ref","render_manifest_digest","qc_report_ref","qc_report_digest","platform_intents","post_copy","post_copy_trace_refs","thumbnail_ref","metadata","disclaimer_profile_ref","content_valid_until","source_fact_package_refs","source_fact_package_bindings","experiment_refs","created_at","package_digest"],"properties":{"schema_version":{"const":"video-publication-package.v1"},"publication_package_id":{"$ref":"common.schema.json#/$defs/Id"},"video_story_id":{"$ref":"common.schema.json#/$defs/Ref"},"creative_variant_id":{"$ref":"common.schema.json#/$defs/Ref"},"render_artifact_ref":{"$ref":"common.schema.json#/$defs/Ref"},"render_manifest_ref":{"$ref":"common.schema.json#/$defs/Ref"},"render_manifest_digest":{"$ref":"common.schema.json#/$defs/Digest"},"qc_report_ref":{"$ref":"common.schema.json#/$defs/Ref"},"qc_report_digest":{"$ref":"common.schema.json#/$defs/Digest"},"platform_intents":{"type":"array","minItems":1,"items":{"$ref":"#/$defs/PlatformIntent"}},"post_copy":{"type":"string"},"post_copy_trace_refs":{"$ref":"common.schema.json#/$defs/RefSet"},"thumbnail_ref":{"type":["string","null"]},"metadata":{"type":"object"},"disclaimer_profile_ref":{"$ref":"common.schema.json#/$defs/Ref"},"content_valid_until":{"$ref":"common.schema.json#/$defs/Timestamp"},"source_fact_package_refs":{"$ref":"common.schema.json#/$defs/RefSet"},"source_fact_package_bindings":{"type":"array","minItems":1,"items":{"$ref":"common.schema.json#/$defs/DigestRef"}},"experiment_refs":{"$ref":"common.schema.json#/$defs/RefSet"},"created_at":{"$ref":"common.schema.json#/$defs/Timestamp"},"package_digest":{"$ref":"common.schema.json#/$defs/Digest"}},"$defs":{"PlatformIntent":{"type":"object","additionalProperties":false,"required":["platform","target_account_ref","publish_mode","scheduled_window","caption_or_description_variant_ref","hashtag_profile_ref","thumbnail_policy_ref","external_side_effect_class"],"properties":{"platform":{"enum":["tiktok","instagram_reels","youtube_shorts","youtube","other"]},"target_account_ref":{"$ref":"common.schema.json#/$defs/Ref"},"publish_mode":{"enum":["MANUAL","SUPERVISED","AUTOMATED","SHADOW"]},"scheduled_window":{"type":"object","additionalProperties":false,"required":["not_before","not_after"],"properties":{"not_before":{"$ref":"common.schema.json#/$defs/Timestamp"},"not_after":{"$ref":"common.schema.json#/$defs/Timestamp"}}},"caption_or_description_variant_ref":{"$ref":"common.schema.json#/$defs/Ref"},"hashtag_profile_ref":{"$ref":"common.schema.json#/$defs/Ref"},"thumbnail_policy_ref":{"$ref":"common.schema.json#/$defs/Ref"},"external_side_effect_class":{"type":"string","minLength":1}}}}}
