{"schema_version":"video-publication-package.v1","publication_package_id":"pub.mlb.sf-lad.1a","video_story_id":"story.mlb.sf-lad.20260908.1","creative_variant_id":"creative.mlb.sf-lad.20260908.1a","render_artifact_ref":"artifact://video/mlb-sf-lad-1a.mp4","render_manifest_ref":"render-manifest.mlb.sf-lad.1a","render_manifest_digest":"sha256:f70a860b89c7f45910f3e3850bd6945721037b348ecf2f3bd705d8afb8b0a752","qc_report_ref":"qc.mlb.sf-lad.1a","qc_report_digest":"sha256:cdf02402dd5e79af6390b0758e0fb7a47e46379a96c556b6627240790322b967","platform_intents":[{"platform":"tiktok","target_account_ref":"tdl.tiktok.main","publish_mode":"MANUAL","scheduled_window":{"not_before":"2026-09-08T16:15:00Z","not_after":"2026-09-08T23:00:00Z"},"caption_or_description_variant_ref":"postcopy.1","hashtag_profile_ref":"tdl-baseball.v1","thumbnail_policy_ref":"vertical-cover.v1","external_side_effect_class":"SOCIAL_POST_CREATE"}],"post_copy":"The model has San Francisco at 61.8% tonight. Approved play: SF ML.","post_copy_trace_refs":["fact.model-prob","fact.pick"],"thumbnail_ref":null,"metadata":{"story_family":"single_pick"},"disclaimer_profile_ref":"sports-betting-general.v1","content_valid_until":"2026-09-08T23:30:00Z","source_fact_package_refs":["pfp.mlb.sf-lad.20260908.v1"],"source_fact_package_bindings":[{"ref":"pfp.mlb.sf-lad.20260908.v1","digest":"sha256:2abfa3c2a8c07afe7b60d5d7645c594a06ba87164c13252b0351dc9ba5d95c1a"}],"experiment_refs":[],"created_at":"2026-09-08T16:14:00Z","package_digest":"sha256:0cfa98f5b4db822601a3eab4fdffd37ffe634547d6e19ae0c76167d324c03cf2"}
